Delibera,Tipologia,DataConsiglio,Oggetto,NumPG,AnnoPG,DataPubblicazione,Altri,Testo,Consigliere
,Delibera di Consiglio,2011-12-20,AFFIDAMENTO DEI SERVIZI AFFERENTI IL PIANO SOSTA ED I SERVIZI COMPLEMENTARI ALLA MOBILITA': INDIRIZZI IN ORDINE ALL'AVVIO DELLA PROCEDURA DI GARA ED ALLA ATTRIBUZIONE ALLA SOCIETA' S.R.M. SRL DELLE FUNZIONI DI STAZIONE APPALTANTE. PROSECUZIONE DELL'ATTUALE AFFIDAMENTO AD ATC SPA FINO ALLA CONCLUSIONE DELLE PROCEDURE DI GARA.,272229,2011,2011-12-22,,http://atti.comune.bologna.it/atti/delibere.nsf/0/412567050032ED32C1257944005A5F05?OpenDocument,
,Delibera di Consiglio,2011-12-20,APPROVAZIONE DEL SECONDO PIANO TRIENNALE PER IL CONTENIMENTO DELLE SPESE DI FUNZIONAMENTO DEL COMUNE DI BOLOGNA,273449,2011,2011-12-22,,http://atti.comune.bologna.it/atti/delibere.nsf/0/412567050032ED32C125794B004EAD2E?OpenDocument,
,Delibera di Consiglio,2011-12-20,"ASSENSO ALL'ACCORDO DI PROGRAMMA ( III FASE) , AD INTEGRAZIONE DELL'ACCORDO I FASE, IN VARIANTE AL POC DEL COMUNE DI BOLOGNA, COMPORTANTE APPOSIZIONE DI VINCOLI ESPROPRIATIVI E DICHIARAZIONE DI PUBBLICA UTILITA' (LR 20/00 E LR 37/02) PER LA REALIZZAZIONE, NEI COMUNI DI BOLOGNA E GRANAROLO DELL'EMILIA, DELLE OPERE PUBBLICHE DI VIABILITA' NECESSARIE PER L'ACCESSO AL NUOVO INSEDIAMENTO DELLE ATTIVITA' OPERATIVE DI HERA SPA IN ZONA FRULLO (COMUNI DI GRANAROLO DELL'EMILIA E CASTENASO).",278753,2011,2011-12-22,,http://atti.comune.bologna.it/atti/delibere.nsf/0/412567050032ED32C125795300436403?OpenDocument,
,Delibera di Consiglio,2011-12-20,SINTRA BOLOGNA SRL: AVVIO DELLA PROCEDURA DI LIQUIDAZIONE.,282626,2011,2011-12-22,,http://atti.comune.bologna.it/atti/delibere.nsf/0/412567050032ED32C1257959004D02BC?OpenDocument,
,Delibera di Consiglio,2011-12-23,"APPROVAZIONE DEL SECONDO ADEGUAMENTO DEL 'PROGRAMMA DEI LAVORI PUBBLICI 2011-2013', PREVISTO DALL'ART. 128 DEL D.LGS. 163/2006,  DELL'  'ELENCO ANNUALE DEI LAVORI PER IL 2011' E DEL' PIANO POLIENNALE DEI LAVORI PUBBLICI E DEGLI INVESTIMENTI PER IL TRIENNIO 2011-2013'.",276438,2011,2011-12-28,,http://atti.comune.bologna.it/atti/delibere.nsf/0/412567050032ED32C12579490042AA56?OpenDocument,
,Delibera di Consiglio,2011-12-23,"VARIANTE AL POC PER LA LOCALIZZAZIONE DELLA CONDOTTA INTERRATA DI SMALTIMENTO DELLE ACQUE BIANCHE AFFERENTI LA ZIS R5.3 BERTALIA-LAZZARETTO, DAL CONFINE DEL COMPARTO FINO AL FIUME RENO. APPOSIZIONE DI VINCOLO PREORDINATO ALL'ESPROPRIO. ADOZIONE",282864,2011,2011-12-28,,http://atti.comune.bologna.it/atti/delibere.nsf/0/412567050032ED32C12579590035BA67?OpenDocument,
,Delibera di Consiglio,2011-12-23,COMITATO URBAN CENTER BOLOGNA. MODIFICHE ATTO COSTITUTIVO E STATUTO.,285803,2011,2011-12-28,,http://atti.comune.bologna.it/atti/delibere.nsf/0/412567050032ED32C1257965002499D3?OpenDocument,
,OdG,2011-12-23,"ORDINE DEL GIORNO PER CHIEDERE ALLE CAMERE CHE NELLA STESURA DEFINITIVA DELLA NUOVA TASSAZIONE VENGANO PREVISTE AGEVOLAZIONI A CANONE CONCORDATO E SI REINTEGRI IL FINANZIAMENTO DEDICATO AL FONDO PER GLI AFFITTI, PRESENTATO DAL CONSIGLIERE PIAZZA ED ALTRI IN DATA 14.12.2011",288938,2011,,"CIPRIANI LORENZO - 26392"",""LA TORRE CATHY - 33979"",""LO GIUDICE SERGIO - 18313"",""MARCHESINI ANGELO - 15586"",""PIERALISI MIRCO - 33980",,33985
,OdG,2011-12-23,"ORDINE DEL GIORNO PER INVITARE LA GIUNTA A METTERE IN CAMPO TUTTE LE MISURE CONSENTITE AFFINCHE' LE LAVORATRICI E I LAVORATORI DEL COMUNE DI BOLOGNA POSSANO RICEVERE QUANTO DI LORO SPETTANZA IN MERITO AL PREMIO DI PRODUTTIVITA', PRESENTATO DALLA CONSIGLIERA MIGNANI ED ALTRI IN DATA 14.12.2011",288956,2011,,"ALDROVANDI STEFANO - 33986"",""CAVIANO PASQUALE - 32714"",""CIPRIANI LORENZO - 26392"",""LA TORRE CATHY - 33979"",""LO GIUDICE SERGIO - 18313",,32794
,OdG,2011-12-23,"ORDINE DEL GIORNO PER INVITARE LA GIUNTA A MANTENERE, ANCHE PER IL PROSSIMO ANNO, LE FORME DI INDENNITA' OGGI PREVISTE PER GLI APPARTENENTI AI CONSIGLI DI QUARTIERE, PRESENTATO DALLA CONSIGLIERA LA TORRE ED ALTRI IN DATA 14.12.2011",289000,2011,,,,
,Delibera di Consiglio,2011-12-23,"ANTICIPAZIONE DI EURO 6.162.000 A FAVORE DELLA SOCIETA' PARTECIPATA SRM SRL, CON RIMBORSO NEL TERMINE MASSIMO DEL 15/12/2012.",289831,2011,2011-12-28,,http://atti.comune.bologna.it/atti/delibere.nsf/0/412567050032ED32C12579680031A4EB?OpenDocument,
,OdG,2011-12-23,ORDINE DEL GIORNO PER INVITARE IL SINDACO E LA GIUNTA AD INTRAPRENDERE UN PERCORSO DI CONFRONTO PER VALUTARE E APPROFONDIRE LE RICHIESTE DELLE ASSOCIAZIONI DEI TAXISTI E DEL SERVIZIO N.C.C. PRESENATO DAL CONSIGLIERE CRITELLI ED ALTRI IN DATA 20/12/2011,293879,2011,,"ALDROVANDI STEFANO - 33986"",""BORGONZONI LUCIA - 33983"",""BUGANI MASSIMO - 33984"",""CARELLA DANIELE - 8904"",""CASTALDINI VALENTINA - 27997"",""CAVIANO PASQUALE - 32714"",""FACCI MICHELE - 32712"",""GHETTI MAURIZIO - 22034"",""LAMA ROSSELLA - 32704"",""LISEI MARCO - 21843"",""LO GIUDICE SERGIO - 18313"",""MARCHESINI ANGELO - 15586"",""MELEGA CORRADO - 27197"",""PETRELLA TOMMASO - 9097"",""PIAZZA MARCO - 33985"",""PIERALISI MIRCO - 33980"",""SALSI FEDERICA - 32861"",""SAZZINI LORENZO - 33987"",""TOMASSINI LORENZO - 27208",,29442
,OdG,2012-01-09,ORDINE DEL GIORNO PER LA CREAZIONE DI UN' INDUSTRIA DELLA CULTURA E DELLO SPETTACOLO A BOLOGNA PRESENTATO DAL CONSIGLIERE ALDROVANDI IN DATA 27.6.2011 E SUCCESSIVAMENTE SOTTOSCRITTO DA ALTRI IN DATA 29/09/2011.,157241,2011,,,,33986
,OdG,2012-01-09,"ORDINE DEL GIORNO IN MERITO AL RICONOSCIMENTO DELL'ACQUA COME BENE COMUNE E DEL SERVIZIO IDRICO INTEGRATO COME SERVIZIO PUBBLICO, PRESENTATO DAL CONSIGLIERE PIAZZA ED ALTRI IN DATA 11.07.2011",171728,2011,,"BUGANI MASSIMO - 33984"",""SALSI FEDERICA - 32861",,33985
,OdG,2012-01-09,"ORDINE DEL GIORNO TESO AD INCENTIVARE IL CONSUMO DI PRODOTTI TIPICI LOCALI (ORTO-FRUTTA E LATTICINI), MIRANDO CONTEMPORANEAMENTE ALLA QUALITA' DEI PRODOTTI CORRELATI E AD UNA AGRICOLTURA BIO-SOSTENIBILE, CONTRIBUENDO SOPRATTUTTO A RIDURRE L'INQUINAMENTO AMBIENTALE LEGATO AL TRASPORTO DELLE DERRATE ALIMENTARI E INFLUENZANDO POSITIVAMENTE SUL BILANCIO ENERGETICO DEL COMUNE DI BOLOGNA PRESENTATO DALLA CONSIGLIERA COCCONCELLI IN DATA 23.08.2011",197141,2011,,"SANTI RAFFAELLA - 9181"",""SAZZINI LORENZO - 33987",,33981
,OdG,2012-01-09,ORDINE DEL GIORNO PER INVITARE LA GIUNTA A SOTTOSCRIVERE UN PROGETTO VOLTO AD UN PERCORSO MULTI-DISCIPLINARE CHE COMPORTI L'APERTURA DI UN AMBULATORIO POLI-SPECIALISTICO DEDICATO ALLA DISABILITA'. PRESENTATO DALLA CONSIGLIERA COCCONCELLI IN DATA 23.08.2011 ED ALTRI IN DATA 25.10.11,197046,2011,,,,33981
,OdG,2012-01-09,"ORDINE DEL GIORNO RELATIVO ALL'INTRODUZIONE DEL MECCANISMO DEL VUOTO A RENDERE E ALL'AVVIO DI UNO STUDIO DI FATTIBILITA' PER LA CREAZIONE DI UNA FILIERA PER IL RIUTILIZZO DEGLI IMBALLAGGI, PRESENTATO DALLA CONSIGLIERA LA TORRE IN DATA 27.09.2011",225503,2011,,,,33979
,OdG,2012-01-09,"ORDINE DEL GIORNO SULL' INTERVENTO PER IL SOSTEGNO ALLE ATTIVITA' DIDATTICHE DEGLI ISTITUTI SCOLASTICI BOLOGNESI, PRESENTATO DAL CONSIGLIERE PIERALISI IN DATA 27.09.2011 ED ALTRI IN DATA 20.10.2011.",225574,2011,,,,33980
,OdG,2012-01-09,"ORDINE DEL GIORNO PER CHIEDERE ALLA GIUNTA DI PORRE IN ESSERE TUTTE LE AZIONI NECESSARIE A MANTENERE L'ATTUALE LIVELLO DEI SERVIZI NELLE SCUOLE D'INFANZIA E NEI NIDI COMUNALI, ANCHE NELLE MORE DEL CAMBIAMENTO DELLA NORMATIVA INTERVENUTO AD ANNO SCOLASTICO AVVIATO, PRESENTATO DALLA CONSIGLIERA LA TORRE ED ALTRI NELLA SEDUTA DEL 9 GENNAIO 2012 E APPROVATO NEL CORSO DELLA SEDUTA STESSA",3824,2012,,"CAVIANO PASQUALE - 32714"",""LO GIUDICE SERGIO - 18313",,33979
,OdG,2012-01-16,"ORDINE DEL GIORNO PER INVITARE IL SINDACO, LA GIUNTA E I PARLAMENTARI BOLOGNESI A FARE TUTTO IL POSSIBILE AFFINCHE' IL GOVERNO CONSENTA AL PIU' PRESTO ALLA PROCURA DI BOLOGNA IL LIBERO ACCESSO A TUTTI I DOCUMENTI RIGUARDANTI LA STRAGE DEL 2 AGOSTO 1980, PRESENTATO DAL CONSIGLIERE BUGANI IN DATA 12.9.2011 E ALTRI IN DATA 25.10.2011.",211154,2011,,,,33984
,Delibera di Consiglio,2012-01-16,"CESSIONE DELLA NUDA PROPRIETA' DELL'AREA SITA IN BOLOGNA, VIA DOZZA N.8, IN FAVORE DEL SUPERFICIARIO GRUPPO HERA SPA.",275987,2011,2012-01-18,,http://atti.comune.bologna.it/atti/delibere.nsf/0/56BFCCE69245447BC125794400341A4E?OpenDocument,
,Delibera di Consiglio,2012-01-16,APPROVAZIONE DEL BILANCIO AMBIENTALE CONSUNTIVO 2010 DEL COMUNE DI BOLOGNA,289249,2011,2012-01-18,,http://atti.comune.bologna.it/atti/delibere.nsf/0/9C1A29F0D61099E4C125796700379682?OpenDocument,
,Delibera di Consiglio,2012-01-16,"APPROVAZIONE DI MODIFICHE AL REGOLAMENTO COMUNALE PG  161731/98 CHE DISCIPLINA LA COLLOCAZIONE DELLE INSEGNE DI ESERCIZIO, DEI CARTELLI PUBBLICITARI, DELLE TENDE SOLARI, DEGLI ALTRI MEZZI PUBBLICITARI.",290024,2011,2012-01-18,,http://atti.comune.bologna.it/atti/delibere.nsf/0/28B5679E813C3097C1257967005D0981?OpenDocument,
,OdG,2012-01-16,"ORDINE DEL GIORNO DI ADESIONE ALLA CAMPAGNA 'IO MI CHIAMO GIOVANNI TIZIAN' PER TESTIMONIARE IL PROPRIO IMPEGNO CONTRO TUTTE LE FORME DI CRIMINALITA' ORGANIZZATA, PRESENTATO DAL CONSIGLIERE CRITELLI E ALTRI NELLA SEDUTA DEL 16 GENNAIO 2012 E APPROVATO NEL CORSO DELLA SEDUTA STESSA",9513,2012,,"BARCELO' LIZANA LEONARDO LUIS - 27189"",""BENASSI MARZIA - 33977"",""BUGANI MASSIMO - 33984"",""CAVIANO PASQUALE - 32714"",""CEVENINI MAURIZIO - 9116"",""CIPRIANI LORENZO - 26392"",""ERRANI FRANCESCO - 33978"",""GHETTI MAURIZIO - 22034"",""LAMA ROSSELLA - 32704"",""LO GIUDICE SERGIO - 18313"",""MAZZANTI CLAUDIO - 9076"",""MELEGA CORRADO - 27197"",""MIGNANI MARIANNA - 32794"",""PETRELLA TOMMASO - 9097"",""PIERALISI MIRCO - 33980"",""SANTI RAFFAELLA - 9181"",""ZACCHIROLI BENEDETTO - 27481",,29442
,OdG,2012-01-16,"ORDINE DEL GIORNO PER AUSPICARE CHE, A SEGUITO DELLA CHIUSURA DELLA SEDE SINDACALE FIOM - CGIL ALL'INTERNO DELL'AZIENDA MAGNETI MARELLI, IN OGNI AZIENDA DELLA NOSTRA CITTA' SIANO CONSENTITE LE LIBERE ESPRESSIONI DI TUTTE LE SIGLE SINDACALI E LA LORO PARTECIPAZIONE AGLI ORGANISMI DI RAPPRESENTANZA DEI LAVORATORI, PRESENTATO DAL CONSIGLIERE PIERALISI ED ALTRI NELLA SEDUTA DEL 16 GENNAIO 2012 E APPROVATO NEL CORSO DELLA SEDUTA STESSA",9622,2012,,"BENASSI MARZIA - 33977"",""CAVIANO PASQUALE - 32714"",""CEVENINI MAURIZIO - 9116"",""CIPRIANI LORENZO - 26392"",""FERRI MARIARAFFAELLA - 27410"",""LA TORRE CATHY - 33979"",""LAMA ROSSELLA - 32704"",""LO GIUDICE SERGIO - 18313"",""MARCHESINI ANGELO - 15586"",""MELEGA CORRADO - 27197"",""MIGNANI MARIANNA - 32794"",""PETRELLA TOMMASO - 9097"",""SAZZINI LORENZO - 33987",,33980
,OdG,2012-01-16,"ORDINE DEL GIORNO PER PROPORRE UN RICONOSCIMENTO FORMALE AL COMMISSARIATO DUE TORRI SAN FRANCESCO E ALL'AGENTE DI POLIZIA PROSPERI PER IL SUO COMPORTAMENTO VIRTUOSO, PRESENTATO DALLA CONSIGLIERA SCARANO E ALTRI NELLA SEDUTA DEL 16 GENNAIO 2012 E APPROVATO NEL CORSO DELLA SEDUTA STESSA",9661,2012,,"ALDROVANDI STEFANO - 33986"",""GATTUSO PATRIZIO GIUSEPPE - 20144"",""LISEI MARCO - 21843"",""TOMASSINI LORENZO - 27208",,33982
,OdG,2012-01-23,"ORDINE DEL GIORNO SUL CONTRASTO ALL'EVASIONE PER SERVIZI SOCIO-EDUCATIVI,  PRESENTATO DAL CONSIGLIERE ERRANI ED ALTRO IN DATA 19.09.2011",218607,2011,,PIERALISI MIRCO - 33980,,33978
,OdG,2012-01-23,"ORDINE DEL GIORNO TESO A INVITARE IL SINDACO E LA GIUNTA MUNICIPALE AD ADOPERARSI PRESSO LA REGIONE EMILIA-ROMAGNA AFFINCHE' IL ' PERCORSO AUTISTICO' RECENTEMENTE APPROVATO, SIA APPLICATO RAPIDAMENTE IN TUTTE LE SUE ARTICOLAZIONI E CONTEMPORANEAMENTE VENGA INDIVIDUATO PER L'AREA METROPOLITANA BOLOGNESE UN SERVIZIO CHE SI OCCUPI DI TROVARE ADEGUATE SOLUZIONI PER L'ASSISTENZA AI CASI PIU' GRAVI,  PRESENTATO DAL CONSIGLIERE BUGANI ED ALTRI IN DATA 27/09/2011 DURANTE LA SEDUTA DELLA V COMMISSIONE",256459,2011,,"CAVIANO PASQUALE - 32714"",""ERRANI FRANCESCO - 33978"",""MELEGA CORRADO - 27197",,33984
,Delibera di Consiglio,2012-01-23,"NULLA OSTA ALLA REALIZZAZIONE DI INTERVENTI DA PARTE DI ACER NELL'AMBITO DI UN COMPLESSIVO PROGETTO DI RIQUALIFICAZIONE DEGLI EDIFICI ED IL SUPERAMENTO DELLE BARRIERE ARCHITETTONICHE , IN VIA MARIA MELATO N.  4  E 6  AI SENSI DEGLI ARTICOLI 7 E 15 DELLA LR 31/02, IN DEROGA  AL REGOLAMENTO URBANISTICO EDILIZIO VIGENTE.",5025,2012,2012-01-25,,http://atti.comune.bologna.it/atti/delibere.nsf/0/AB5EDA3D7673D186C125794B003194BE?OpenDocument,
,Delibera di Consiglio,2012-01-23,"NULLA-OSTA AL RILASCIO DI PERMESSO DI COSTRUIRE IN DEROGA ALLE NORME DEL RUE VIGENTE, RELATIVO ALLA NUOVA COSTRUZIONE DI UN VOLUME TECNOLOGICO  PREVISTO SULLA COPERTURA DELL'EDIFICIO SEDE PROVINCIALE DELL'INPS  IN VIA ANTONIO GRAMSCI N.  6,  AI SENSI DELL'ARTICOLO 15 DELLA LR 31/02.",5172,2012,2012-01-25,,http://atti.comune.bologna.it/atti/delibere.nsf/0/339E3B068CBD4EE3C125794B003E17DE?OpenDocument,
,OdG,2012-01-23,"ORDINE DEL GIORNO PER ADERIRE ALLA PETIZIONE LANCIATA DALLA FIAB CHE CHIEDE DI ESTENDERE LA COPERTURA ASSICURATIVA ANCHE A CHI UTILIZZA LA BICICLETTA, PRESENTATA DAL CONSIGLIERE CRITELLI NELLA SEDUTA DEL 23 GENNAIO 2012 E APPROVATO NEL CORSO DELLA SEDUTA STESSA",16251,2012,,,,
,OdG,2012-01-23,"ORDINE DEL GIORNO PER ESPRIMERE SOLIDARIETA' AI LAVORATORI DEL QUOTIDIANO L'INFORMAZIONE E PER AUSPICARE CHE L'ASSEMBLEA DEI SOCI DE L'EDITORIALE BOLOGNA SRL POSSA SUPERARE IL MOMENTO CRITICO SENZA SOSPENDERNE LA PUBBLICAZIONE, PRESENTATO DAL CONSIGLIERE LO GIUDICE E ALTRI NELLA SEDUTA DEL 23 GENNAIO 2012 E APPROVATO NEL CORSO DELLA SEDUTA STESSA",16289,2012,,"CAVIANO PASQUALE - 32714"",""CRITELLI FRANCESCO - 29442"",""LA TORRE CATHY - 33979"",""LAMA ROSSELLA - 32704"",""MELEGA CORRADO - 27197",,18313
,OdG,2012-01-30,ORDINE DEL GIORNO SULLA PROMOZIONE DELLA COOPERAZIONE DI TIPO B PER L'INSERIMENTO LAVORATIVO PRESENTATO DAL CONSIGLIERE ERRANI ED ALTRI IN DATA 19.09.2011.,218574,2011,,SAZZINI LORENZO - 33987,,33978
,OdG,2012-01-30,"ORDINE DEL GIORNO SUL D. LGS 138 E PRIVATIZZAZIONE DEI SERVIZI PUBBLICI, PRESENTATO DAL CONSIGLIERE PIAZZA ED ALTRI IN DATA 19.9.2011.",218142,2011,,"BUGANI MASSIMO - 33984"",""CIPRIANI LORENZO - 26392"",""LA TORRE CATHY - 33979"",""PIERALISI MIRCO - 33980"",""SALSI FEDERICA - 32861"",""SAZZINI LORENZO - 33987",,33985
,OdG,2012-01-30,ORDINE DEL GIORNO PER L'INTRODUZIONE DELLA RACCOLTA DIFFERENZIATA CON SISTEMA PORTA A PORTA PRESENTATO DAL CONSIGLIERE LA TORRE IN DATA 30.09.2011 ED ALTRI IN DATA 9.11.2011.,232825,2011,,,,33979
,OdG,2012-01-30,"ORDINE DEL GIORNO SUL CENSIMENTO E MESSA IN SICUREZZA DELL' AMIANTO NEGLI EDIFICI, PRESENTATO DAL CONSIGLIERE BUGANI IN DATA 28.10.2011.",255692,2011,,,,33984
,OdG,2012-01-30,"ORDINE DEL GIORNO SULLO SMALTIMENTO ABUSIVO DEI RIFIUTI CON PARTICOLARE RIFERIMENTO A QUELLI CHE CONTENGONO COMPONENTI IN AMIANTO, PRESENTATO DAL CONSIGLIERE GHETTI IN DATA 7.11.2011.",260779,2011,,,,22034
,OdG,2012-01-30,"ORDINE DEL GIORNO A SOSTEGNO DELL'INIZIATIVA DI LEGGE POPOLARE PER SUPERARE LA PRATICA DELLA SOTTOSCRIZIONE DI DIMISSIONI IN BIANCO ALL'ATTO DELL'ASSUNZIONE, PRESENTATO DALLA CONSIGLIERA FERRI E ALTRI NELLA SEDUTA DEL 30 GENNAIO 2012 E APPROVATO NEL CORSO DELLA SEDUTA STESSA",22415,2012,,"CASTALDINI VALENTINA - 27997"",""LA TORRE CATHY - 33979"",""MIGNANI MARIANNA - 32794"",""BENASSI MARZIA - 33977"",""SANTI CASALI RAFFAELLA"",""LAMA ROSSELLA - 32704"",""COCCONCELLI MIRKA - 33981"",""BORGONZONI LUCIA - 33983"",""SCARANO PAOLA FRANCESCA - 33982"",""LEMBI SIMONA - 32746"",""BUGANI MASSIMO - 33984",,27410
,OdG,2012-02-06,"ORDINE DEL GIORNO PER IMPEGNARE LA GIUNTA A SOSTENERE ED AVVALERSI DI IMPRESE DEL TERRITORIO PER LAVORI INFERIORI AD UN MILIONE DI EURO, PRESENTATO DAL CONSIGLIERE BERNARDINI IN DATA 21.9.2011 ED ALTRI IN DATA 17.11.2011.",221548,2011,,,,32719
,OdG,2012-02-06,"ORDINE DEL GIORNO SULL'INTITOLAZIONE DI UN GIARDINO A NILDE IOTTI, PRESENTATO DALLA CONSIGLIERA MARIARAFFAELLA FERRI IN DATA 17.10.11 ED ALTRI IN DATA 30/11/2011",244620,2011,,"CAVIANO PASQUALE - 32714"",""LA TORRE CATHY - 33979"",""LO GIUDICE SERGIO - 18313",,27410
,OdG,2012-02-06,ORDINE DEL GIORNO SUGLI INDIRIZZI DEL CONSIGLIO COMUNALE IN MERITO ALL'AVVIO DEI LAVORI DEL COMITATO PROMOTORE 'BOLOGNA 2021'PER L'ATTIVAZIONE DEL PIANO STRATEGICO METROPOLITANO PRESENTATO DAL CONSIGLIERE SERGIO LO GIUDICE IN DATA 14/11/2011.,266200,2011,,,,18313
,OdG,2012-02-06,"ORDINE DEL GIORNO VOLTO A RICHIEDERE AD AGCOM-AUTORITA' GARANTE DELLE TELECOMUNICAZIONI -L'ABBASSAMENTO DELLA TARIFFA DI TERMINAZIONE MOBILE A TUTELA DEI CONSUMATORI ENTRO IL 2012, PRESENTATO DAL CONSIGLIERE ALDROVANDI IN DATA 21/11/2011 E DA ALTRI CONSIGLIERI IN DATA 15.12.2011.",271988,2011,,,,33986
,Delibera di Consiglio,2012-02-06,RISTRUTTURAZIONE DEL COMPARTO URBANISTICO DELIMITATO DALLE VIE BELMELORO - SELMI - SAN GIACOMO: REALIZZAZIONE DI INTERVENTI INFRASTRUTTURALI DI MOBILITA' SOSTENIBILE. APPROVAZIONE CONVENZIONE TRA COMUNE DI BOLOGNA E ALMA MATER STUDIORUM - UNIVERSITA' DI BOLOGNA.,10761,2012,2012-02-08,,http://atti.comune.bologna.it/atti/delibere.nsf/0/7E7FBEE7F9AC4EE3C125797A0049EC0E?OpenDocument,
,OdG,2012-02-06,"ORDINE DEL GIORNO PER INVITARE I PARLAMENTARI ELETTI IN EMILIA ROMAGNA A SOSTENERE UNA RIMODULAZIONE DEI COSTI PER I RINNOVI DEI PERMESSI DI SOGGIORNO, PRESENTATO DAL CONSIGLIERE BARCELO' LIZANA E ALTRI NELLA SEDUTA DEL 6 FEBBRAIO 2012 E APPPROVATO NEL CORSO DELLA SEDUTA STESSA.",27568,2012,,"BENASSI MARZIA - 33977"",""CEVENINI MAURIZIO - 9116"",""CIPRIANI LORENZO - 26392"",""ERRANI FRANCESCO - 33978"",""FERRI MARIARAFFAELLA - 27410"",""GHETTI MAURIZIO - 22034"",""LA TORRE CATHY - 33979"",""LAMA ROSSELLA - 32704"",""LO GIUDICE SERGIO - 18313"",""MARCHESINI ANGELO - 15586"",""MAZZANTI CLAUDIO - 9076"",""MELEGA CORRADO - 27197"",""MIGNANI MARIANNA - 32794"",""PETRELLA TOMMASO - 9097"",""PIERALISI MIRCO - 33980"",""SAZZINI LORENZO - 33987"",""ZACCHIROLI BENEDETTO - 27481",,27189
,OdG,2012-02-06,"ORDINE DEL GIORNO RELATIVO AL RISPARMIO ENERGETICO DEGLI ESERCIZI COMMERCIALI, PRESENTATO DAL CONSIGLIERE LA TORRE E ALTRI NELLA SEDUTA DEL 6 FEBBRAIO 2012 E APPROVATO NEL CORSO DELLA SEDUTA STESSA",27655,2012,,"CIPRIANI LORENZO - 26392"",""PIAZZA MARCO - 33985"",""PIERALISI MIRCO - 33980"",""SAZZINI LORENZO - 33987",,33979
,OdG,2012-02-15,"ORDINE DEL GIORNO TESO AD INVITARE LA GIUNTA A RIDETERMINARE IN SENSO MIGLIORATIVO PER GLI UTENTI LE TARIFFE STABILITE PER LA RIMOZIONE E CUSTODIA DEI VEICOLI, PER ADEGUARE LE STESSE AI CRITERI DI EGUAGLIANZA, DI EQUIT E DI BUONA AMMINISTRAZIONE. PRESENTATO DAL CONSIGLIERE FACCI IN DATA 28.11.2011.",277239,2011,,,,32712
,OdG,2012-02-15,"ORDINE DEL GIORNO PER CHIEDERE AL GOVERNO E AL PARLAMENTO DI RIDURRE L'ALIQUOTA IMU PER GLI ALLOGGI A PROPRIETA' INDIVISA EQUIPARANDOLA A QUELLA PER LA PRIMA CASA, PRESENTATO DAL CONSIGLIERE MARCHESINI E ALTRI NELLA SEDUTA DEL 15 FEBBRAIO 2012 E APPROVATO NEL CORSO DELLA SEDUTA STESSA.",38787,2012,,LO GIUDICE SERGIO - 18313,,15586
,Delibera di Consiglio,2012-02-20,ADESIONE ALLA FONDAZIONE RENZO IMBENI 'PER UN'EUROPA DEI DIRITTI'.,27127,2012,2012-02-22,,http://atti.comune.bologna.it/atti/delibere.nsf/0/BB7997017FE9FE66C1257980005C5E17?OpenDocument,
,OdG,2012-02-20,"ORDINE DEL GIORNO PER INVITARE IL SINDACO E LA GIUNTA A MODIFICARE LE REGOLE DELL'APPLICAZIONE ISEE ENTRO MARZO, PRESENTATO DALLA CONSIGLIERA CASTALDINI E ALTRI IN DATA 6.02.2012",28028,2012,,"BERNARDINI MANES - 32719"",""CARELLA DANIELE - 8904"",""COCCONCELLI MIRKA - 33981"",""FACCI MICHELE - 32712"",""GATTUSO PATRIZIO GIUSEPPE - 20144"",""LISEI MARCO - 21843"",""PIAZZA MARCO - 33985"",""SCARANO  PAOLA FRANCESCA"",""TOMASSINI LORENZO - 27208",,27997
,OdG,2012-02-20,"ORDINE DEL GIORNO PER INVITARE IL SINDACO E LA GIUNTA A MODIFICARE I PARAMETRI DI APPLICAZIONE DELL'INDICATORE ISEE ENTRO MARZO, PRESENTATO DALLA CONSIGLIERA SANTI CASALI E ALTRI IN DATA 13.02.2012",34016,2012,,"LO GIUDICE SERGIO - 18313"",""PETRELLA TOMMASO - 9097"",""SAZZINI LORENZO - 33987",,9181
,OdG,2012-02-20,"ORDINE DEL GIORNO PER CHIEDERE AL PARLAMENTO E AL GOVERNO DI NON PROCEDERE ALL'ACQUISTO DEI CACCIABOMBARDIERI F35, PRESENTATO DAL CONSIGLIERE PIAZZA E ALTRI, NELLA SEDUTA DEL 20 FEBBRAIO 2012 E APPROVATO NEL CORSO DELLA SEDUTA STESSA.",44547,2012,,"BUGANI MASSIMO - 33984"",""LO GIUDICE SERGIO - 18313"",""SALSI FEDERICA - 32861"",""SAZZINI LORENZO - 33987"",""ZACCHIROLI BENEDETTO - 27481",,33985
,OdG,2012-02-27,"ORDINE DEL GIORNO TESO A PREDISPORRE UN PIANO CHE PORTI AL RILANCIO E ALLA RIQUALIFICAZIONE STRUTTURALE E MERCEOLOGICA DELLA FIERA DI VIA ALTABELLA E DI SANTA LUCIA PREVEDENDO AGEVOLAZIONI E FORME DI SOSTEGNO PER LA VENDITA DI PRODOTTI MADE IN ITALY E DELLA TRADIZIONE LOCALE LEGATI STRETTAMENTE ALL' ADDOBBO NATALIZIO, AL PRESEPIO E AL DOLCIUMI - PRESENTATO DALLA CONSIGLIERA BORGONZONI E ALTRI IN DATA 17 OTTOBRE 2011",245115,2011,,"BERNARDINI MANES - 32719"",""CASTALDINI VALENTINA - 27997"",""COCCONCELLI MIRKA - 33981"",""SCARANO  PAOLA FRANCESCA",,33983
,OdG,2012-02-27,"ORDINE DEL GIORNO TESO AD INVITARE LA GIUNTA A REPERIRE FONDI PER IL RESTAURO E RISANAMENTO CONSERVATIVO DEL PORTICO DI SAN LUCA, PRESENTATO DAL CONSIGLIERE BERNARDINI ED ALTRI IN DATA 7.11.2011.",260774,2011,,"BORGONZONI LUCIA - 33983"",""COCCONCELLI MIRKA - 33981"",""SCARANO  PAOLA FRANCESCA",,32719
,OdG,2012-02-27,"ORDINE DEL GIORNO PER AUSPICARE UN RAPIDO RIENTRO DALL'INDIA DEI FUCILIERI DEL REGGIMENTO SAN MARCO DELLA MARINA MILITARE, ESPRIMERE SOLIDARIETA' ALLE FAMIGLIE DI TUTTE LE PERSONE COINVOLTE, RICHIEDERE IL RISPETTO DELLE NORMATIVE INTERNAZIONALI E  AUSPICARE CHE LA VICENDA SIA CHIARITA IN TUTTE LE SEDI OPPORTUNE, PRESENTATO DAL CONSIGLIERE LISEI E ALTRO NELLA SEDUTA DEL 27 FEBBRAIO 2012 E APPROVATO NEL CORSO DELLA SEDUTA STESSA",49840,2012,,CRITELLI FRANCESCO - 29442,,21843
,OdG,2012-03-05,"ORDINE DEL GIORNO TESO AD IMPEGNARE IL SINDACO E LA GIUNTA AD ISTITUIRE UN REGISTRO/ALBO COMUNALE DEGLI ASSISTENTI FAMILIARI (EX BADANTI!), PRESSO L' ASSESSORATO ALLE POLITICHE SOCIALI PRESENTATO DALLA CONSIGLIERA COCCONCELLI E ALTRI IN DATA 18 OTTOBRE 2011.",245116,2011,,"BERNARDINI MANES - 32719"",""BORGONZONI LUCIA - 33983"",""SCARANO  PAOLA FRANCESCA"",""TOMASSINI LORENZO - 27208",,33981
,OdG,2012-03-05,"ORDINE DEL GIORNO TESO A VALUTARE LA PROPOSTA, AVANZATA DA ORGANIZZAZIONI SINDACALI, DI STUDIARE ED ELABORARE PERCORSI DI INSERIMENTO IN LAVORI SOCIALMENTE UTILI DELLE PERSONE IN CERCA DI OCCUPAZIONE, DI CHI E' COLPITO OGGI DA CASSA INTEGRAZIONE O DI CHI ADDIRITTURA SI TROVA SENZA AMMORTIZZATORI SOCIALI AL FINE DI IMPIEGARE I SUDDETTI SOGGETTI IN IMPIEGHI DI GRANDE UTILITA' SOCIALE E PUBBLICA, COME LA MANUTENZIONE DELLA CITTA', LA CURA DELLA STESSA E DEL VERDE PUBBLICO. PRESENTATO DAL CONS. BERNARDINI ED ALTRI IN DATA 21/11/2011",271998,2011,,"BORGONZONI LUCIA - 33983"",""COCCONCELLI MIRKA - 33981"",""SCARANO  PAOLA FRANCESCA",,32719
,OdG,2012-03-05,"ORDINE DEL GIORNO SU SOLIDARIETA' AI COMUNI ALLUVIONATI, SALVAGUARDIA DELLA POPOLAZIONE DAI RISCHI PRESENTI SUL TERRITORIO COMUNALE E VINCOLI DEL PATTO DI STABILITA'. PRESENTATO DALLA PRESIDENTE DEL CONSIGLIO IN DATA 14.02.2012 ED ALTRI",35586,2012,,SCARANO  PAOLA FRANCESCA,,32746
,OdG,2012-03-05,"ORDINE DEL GIORNO TESO A PROMUOVERE LA SPERIMENTAZIONE DI UN SISTEMA A SOSTEGNO DELLA DOMICILIARITA' DEGLI ANZIANI, PRESENTATO DAL CONSIGLIERE ERRANI E ALTRI NELLA SEDUTA DEL 05 MARZO 2012 E APPROVATO NEL CORSO DELLA SEDUTA STESSA",55681,2012,,"BARCELO' LIZANA LEONARDO LUIS - 27189"",""BENASSI MARZIA - 33977"",""CEVENINI MAURIZIO - 9116"",""FERRI MARIARAFFAELLA - 27410"",""LO GIUDICE SERGIO - 18313"",""MIGNANI MARIANNA - 32794"",""PIERALISI MIRCO - 33980"",""SAZZINI LORENZO - 33987",,33978
,OdG,2012-03-05,"ORDINE DEL GIORNO TESO A VALUTARE L'IPOTESI DI INTRODURRE, NELLO STATUTO COMUNALE, L'ISTITUTO DEL REFERENDUM ABROGATIVO E PROPOSITIVO, PRESENTATO DAL CONSIGLIERE LA TORRE E ALTRO NELLA SEDUTA DEL 05 MARZO 2012 E APPROVATO NEL CORSO DELLA SEDUTA STESSA",55774,2012,,LO GIUDICE SERGIO - 18313,,33979
,OdG,2012-03-12,INTITOLAZIONE DI UNA VIA CITTADINA ALLA MEMORIA DI MARCELLA DI FOLCO PRESENTATO DAL CONSIGLIERE LA TORRE ED ALTRI IN DATA 07.09.2011,205407,2011,,LO GIUDICE SERGIO - 18313,,33979
,OdG,2012-03-12,"ORDINE DEL GIORNO SUL MIGLIORAMENTO DEL SERVIZIO REFEZIONE SCOLASTICA, PRESENTATO DAL  CONSIGLIERE ERRANI ED ALTRI IN DATA  22.12.2011",284,2012,,"BENASSI MARZIA - 33977"",""LO GIUDICE SERGIO - 18313"",""PETRELLA TOMMASO - 9097"",""PIERALISI MIRCO - 33980",,33978
,Delibera di Consiglio,2012-03-12,DINIEGO DI NULLA OSTA PER PERMESSO DI COSTRUIRE IN DEROGA RICHIESTO AI SENSI DELL'ART. 5 COMMA 13 DELLA L. 106/2011 PER CAMBIO D'USO DA LABORATORIO AD ABITAZIONE CON DEMOLIZIONE E FEDELE RICOSTRUZIONE  ED AUMENTO DI SU IN SAGOMA PER MODIFICA DEL POSIZIONAMENTO DEI SOLAI  DI EDIFICIO DI INTERESSE DOCUMENTALE SITO IN VIA DELLA CERTOSA N.  12,41103,2012,2012-03-14,,http://atti.comune.bologna.it/atti/delibere.nsf/0/4958D9A23F234907C125798F005773A3?OpenDocument,
,Delibera di Consiglio,2012-03-21,INDIRIZZI RELATIVI ALLA DISCIPLINA DEGLI ORARI DELLA CITTA'.MODIFICA DEGLI ARTT. 13 E 15 DEL REGOLAMENTO COMUNALE DI POLIZIA URBANA,52550,2012,2012-03-28,,http://atti.comune.bologna.it/atti/delibere.nsf/0/0ED48A93305BE649C12579AB002A4B26?OpenDocument,
,Delibera di Consiglio,2012-03-21,"INDIRIZZI E AVVISO PUBBLICO PER LA PRESENTAZIONE DI MANIFESTAZIONI DI INTERESSE AGLI INTERVENTI DA COMPRENDERE NEL 'PROGRAMMA PER LA QUALIFICAZIONE URBANA', PREORDINATO A VARIANTE AL PIANO OPERATIVO COMUNALE.",48843,2012,2012-03-23,,http://atti.comune.bologna.it/atti/delibere.nsf/0/E245A58B6F596A88C12579B100305B06?OpenDocument,
,Delibera di Consiglio,2012-03-26,"INTEGRAZIONE DEI CRITERI DI VALUTAZIONE DELLA SITUAZIONE ECONOMICA  UTILE A DETERMINARE, NEL SETTORE DEI SERVIZI EDUCATIVI E SCOLASTICI, IL LIVELLO DI COMPARTECIPAZIONE DEGLI UTENTI AL COSTO E A REGOLARE L'ACCESSO AI SERVIZI E AI CONTRIBUTI ECONOMICI, NELL'AMBITO DEI REGOLAMENTI E DEL SISTEMA TARIFFARIO VIGENTI - DEFINIZIONE DI UN NUOVO INDICATORE VALIDO A PARTIRE DALL'A.S. 2012-2013.",49676,2012,2012-03-28,,http://atti.comune.bologna.it/atti/delibere.nsf/0/FAEE6ED43ADD3974C12579B20027EA6C?OpenDocument,
,Delibera di Consiglio,2012-04-02,APPROVAZIONE DEL REGOLAMENTO PER LA CONCESSIONE DI RATEIZZAZIONI PER IL PAGAMENTO DELLE ENTRATE COMUNALI,2009,2012,2012-04-05,,http://atti.comune.bologna.it/atti/delibere.nsf/0/367C016B56CA0879C125797C002CE54E?OpenDocument,
