Delibera,Tipologia,DataConsiglio,Oggetto,NumPG,AnnoPG,DataPubblicazione,Altri,Testo,Consigliere
33981,OdG,2012-10-01,"ORDINE DEL GIORNO PER IMPEGNARE LA GIUNTA AD ATTIVARE UN PROGRAMMA PREVENZIONE DELLE ALLERGIE E DI TUTELA DELLA SALUTE PUBBLICA ATTRAVERSO AZIONI SUL VERDE PUBBLICO, PRESENTATO DALLA CONSIGLIERA COCCONCELLI ED ALTRI IN DATA 29.11.2011",277245,2011,,"BERNARDINI MANES - 32719"",""BORGONZONI LUCIA - 33983"",""SCARANO  PAOLA FRANCESCA",,33981
33980,OdG,2012-10-01,"ORDINE DEL GIORNO PER INVITARE LA GIUNTA AD ESTENDERE A TUTTI I QUARTIERI CITTADINI IL PROTOCOLLO 'RIFIUTI ZERO NELLE SCUOLE' ADOTTATO DAL QUARTIRE NAVILE CON DELIBERA PGN 89644/2012, PRESENTATO DAL CONSIGLIERE PIERALISI IN DATA 8.5.2012 ED ALTRI IN DATA 01.10.2012",111274,2012,,"ERRANI FRANCESCO - 33978"",""LEMBI SIMONA - 32746"",""SAZZINI LORENZO - 33987",,33980
27208,OdG,2012-10-01,"ORDINE DEL GIORNO PER ESPRIMERE SOLIDARIETA' A TUTTI I CITTADINI COINVOLTI NELL'INCURSIONE INTIMIDATORIA E VIOLENTA DELLA SCORSA SETTIMANA IN UN CONDOMINIO NELLA ZONA DI PIAZZA VERDI, PRESENTATO DAL CONS. TOMASSINI ED ALTRI IN IN DATA 11.6.2012.",142573,2012,,"BERNARDINI MANES - 32719"",""COCCONCELLI MIRKA - 33981"",""GATTUSO PATRIZIO GIUSEPPE - 20144"",""SCARANO PAOLA FRANCESCA - 33982",,27208
,Delibera di Consiglio,2012-10-01,"NULLA-OSTA AL RILASCIO DI PERMESSO DI COSTRUIRE  IN DEROGA ALLE NORME DEL RUE VIGENTE, RELATIVO ALLA NUOVA COSTRUZIONE DI UNA CABINA  DELL' ENEL IN VIA DEL CARROZZAIO N.  12 ,  AI SENSI DELL'ARTICOLO 15 DELLA LR 31/02",213119,2012,2012-10-03,,http://atti.comune.bologna.it/atti/delibere.nsf/0/A396B1AC1AEA29DDC1257A4100371D95?OpenDocument,
,Delibera di Consiglio,2012-10-01,"APPROVAZIONE DI UNA CONVENZIONE TRA IL COMUNE DI BOLOGNA ED IL COMUNE DI CREVALCORE (BO) PER LA CONCESSIONE DI N. 13 ALLOGGI DI E.R.P. DI PROPRIETA' DEL COMUNE DI BOLOGNA, SITI NEI COMUNI DI CALDERARA DI RENO ( BO)  E CASTELLO D'ARGILE (BO), DA ASSEGNARE A NUCLEI FAMILIARI  COLPITI DAL SISMA DEL 20/29 MAGGIO 2012",211904,2012,2012-10-03,,http://atti.comune.bologna.it/atti/delibere.nsf/0/CC71F392A4A43BD6C1257A76004212E7?OpenDocument,
,Delibera di Consiglio,2012-10-08,APPROVAZIONE DELLA FUSIONE PER INCORPORAZIONE DI ACEGAS-APS HOLDING S.R.L. IN HERA  E DEL CONSEGUENTE AUMENTO DI CAPITALE  A SERVIZIO DELLA  PROMOZIONE DI UN'OFFERTA PUBBLICA DI SCAMBIO E  DI  MODIFICHE ALLO STATUTO SOCIALE DI HERA  E  AL CONTRATTO DI ADESIONE AL SINDACATO DI VOTO E DISCIPLINA DEI TRASFERIMENTI AZIONARI STIPULATO IL 21.12.2011.  APPROVAZIONE DELLA  DELEGA  AL CDA PER UN FUTURO AUMENTO DI CAPITALE  DA ESERCITARSI NEL PROSSIMO TRIENNIO E DI UN  ACCORDO DI COMPRAVENDITA DI DIRITTI DI OPZIONE NONCHE' DI CONSEGUENTI MODIFICHE STATUTARIE.,221715,2012,2012-10-10,,http://atti.comune.bologna.it/atti/delibere.nsf/0/AE9A019BFDBE6BAFC1257A80002B0706?OpenDocument,
,Delibera di Consiglio,2012-10-15,ISTITUZIONE PER L'INCLUSIONE SOCIALE E COMUNITARIA 'DON PAOLO SERRA ZANETTI' DEL COMUNE DI BOLOGNA: APPROVAZIONE DEL BILANCIO ANNUALE DI PREVISIONE PER L'ESERCIZIO 2012 E DEL BILANCIO PLURIENNALE 2012-2014. APPROVAZIONE DEL BILANCIO PER L'ESERCIZIO 2012 E PER IL TRIENNIO 2012-2014 SECONDO I PRINCIPI CONTENUTI NEL DPCM 28 DICEMBRE 2011 (SPERIMENTAZIONE DELLA NUOVA DISCIPLINA CONTABILE).,180195,2012,2012-10-17,,http://atti.comune.bologna.it/atti/delibere.nsf/0/59EC536B2E84D759C1257A4B004DA37E?OpenDocument,
,Delibera di Consiglio,2012-10-15,VARIAZIONE AL BILANCIO DI PREVISIONE PER L'ESERCIZIO 2012 A SEGUITO DELL'ANDAMENTO DELLA GESTIONE FINANZIARIA (RAG. III).,219603,2012,2012-10-17,,http://atti.comune.bologna.it/atti/delibere.nsf/0/14423A8CFAB37D0BC1257A7D002AD0A6?OpenDocument,
,Delibera di Consiglio,2012-10-15,DISCIPLINA TRANSITORIA IN MATERIA DI FORMAZIONE DEGLI AGGIORNAMENTI DELLA GRADUATORIA PER L'ASSEGNAZIONE DEGLI ALLOGGI DI EDILIZIA RESIDENZIALE PUBBLICA,226618,2012,2012-10-17,,http://atti.comune.bologna.it/atti/delibere.nsf/0/5DA19EA4E6900B18C1257A840049C890?OpenDocument,
,Delibera di Consiglio,2012-10-15,INDIRIZZI PER L'AFFIDAMENTO DEI SERVIZI AFFERENTI AL PIANO SOSTA E AI SERVIZI COMPLEMENTARI ALLA MOBILITA' DEFINITI CON ATTO COMMISSARIALE PG.N 294925/2010 E CON DELIBERA DI CONSIGLIO COMUNALE P.G. 272229/2011 - CONFERMA E ULTERIORI PRECISAZIONI - CONSEGUENTE MESSA IN LIQUIDAZIONE ATC S.P.A.,228702,2012,2012-10-17,,http://atti.comune.bologna.it/atti/delibere.nsf/0/B8DB4352CDA00102C1257A8600327F9F?OpenDocument,
33985,OdG,2012-10-15,"ORDINE DEL GIORNO PER INVITARE IL GOVERNO E LE CAMERE A VALUTARE UN INTERVENTO LEGISLATIVO PER PERMETTERE UNA PIU' EFFICIENTE GESTIONE DEI SERVIZI INERENTI LA SOSTA, PRESENTATO DAL CONSIGLIERE PIAZZA ED ALTRI DURANTE LA SEDUTA DELLA IV COMMISSIONE IN DATA 11.10.2012.",240577,2012,,"BUGANI MASSIMO - 33984"",""SALSI FEDERICA - 32861",,33985
33985,OdG,2012-10-15,"ORDINE DEL GIORNO PER AUSPICARE CHE NEL PROSSIMO BANDO PER L'AFFIDAMENTO DEL TPL SIANO INCLUSI ANCHE I SERVIZI RELATIVI ALLA SOSTA, SE IL QUADRO LEGISLATIVO NON SARA' MUTATO, PRESENTATO DAL CONSIGLIERE PIAZZA E ALTRI NELLA SEDUTA DEL 15 OTTOBRE 2012 E APPROVATO ALL'UNANIMITA' DEI PRESENTI NEL CORSO DELLA SEDUTA STESSA",244428,2012,,"BUGANI MASSIMO - 33984"",""LA TORRE CATHY - 33979"",""LO GIUDICE SERGIO - 18313"",""SALSI FEDERICA - 32861",,33985
33985,OdG,2012-10-22,"ORDINE DEL GIORNO PER INVITARE LA GIUNTA A INCENTIVARE E PROMUOVERE PROGETTI CHE PREVEDANO L'UTILIZZO DI STOVIGLIE PORTATE DA CASA PURCHE' CONDIVISI DALLE FAMIGLIE, PRESENTATO DAL CONSIGLIERE MARCO PIAZZA ED ALTRI IN DATA 12/4/2012 E FORMALIZZATO DALLA COMMISSIONE DEL 17/05/2012",170126,2012,,"BUGANI MASSIMO - 33984"",""CARELLA DANIELE - 8904"",""CASTALDINI VALENTINA - 27997"",""FACCI MICHELE - 32712"",""LISEI MARCO - 21843"",""SALSI FEDERICA - 32861"",""SCARANO PAOLA FRANCESCA - 33982"",""ALDROVANDI STEFANO - 33986"",""BERNARDINI MANES - 32719"",""ERRANI FRANCESCO - 33978"",""LA TORRE CATHY - 33979"",""LEMBI SIMONA - 32746"",""LO GIUDICE SERGIO - 18313"",""MELEGA CORRADO - 27197"",""PETRELLA TOMMASO - 9097"",""SAZZINI LORENZO - 33987",,33985
26392,OdG,2012-10-22,"ORDINE DEL GIORNO VOLTO AD INVITARE LA GIUNTA A VERIFICARE LA POSSIBILITA' DI ISTITUIRE UN APPOSITO SERVIZIO DI ACCESSO ALLA VISUALIZZAZIONE ED ALLA STAMPA DEL CEDOLINO MENSILE PENSIONISTICO PER I CITTADINI ANZIANI, PRESENTATO DAL CONSIGLIERE CIPRIANI IN DATA 17/05/2012 E SUCCESSIVAMENTE SOTTOSCRITTO DA ALTRI CONSIGLIERI IN DATA 20.7.2012.",123234,2012,,,,26392
27197,OdG,2012-10-22,"ORDINE DEL GIORNO PER INVITARE LA GIUNTA A SOSTENERE IL PROGETTO A FAVORE DELLA SCLEROSI MULTIPLA, PRESENTATO DAL CONSIGLIERE MELEGA ED ALTRI IN DATA 16.7.2012.",174600,2012,,"CAVIANO PASQUALE - 32714"",""MARCHESINI ANGELO - 15586",,27197
,Delibera di Consiglio,2012-10-29,"APPROVAZIONE DEI CRITERI PER LA REALIZZAZIONE DI NUOVI IMPIANTI DI DISTRIBUZIONE DEI CARBURANTI, NORME TECNICHE E PROCEDURALI PER L' INSTALLAZIONE ED IL FUNZIONAMENTO DEGLI STESSI E PER LA GESTIONE DEGLI IMPIANTI ESISTENTI",219377,2012,2012-10-31,,http://atti.comune.bologna.it/atti/delibere.nsf/0/072B039EB9ECA2AEC12579E9004ABDC6?OpenDocument,
33981,OdG,2012-10-29,"ORDINE DEL GIORNO PER INVITARE LA GIUNTA A PORRE IN ATTO, DI CONCERTO CON LA REGIONE EMILIA-ROMAGNA, TUTTI GLI ADEMPIMENTI NECESSARI AL FINE DI FAVORIRE LA REALIZZAZIONE DEL PROGETTO DENOMINATO UNA SCELTA IN COMUNE, DOVE TRAMITE IL COMUNE DI BOLOGNA IL CITTADINO BOLOGNESE RENDE CHIARA E INEQUIVOCABILE LA PROPRIA VOLONTA', IN MERITO ALLA DONAZIONE DEI PROPRI ORGANI E TESSUTI, REGISTRANDO IL PROPRIO ASSENSO SULLA CARTA D'IDENTITA', ALL'ATTO DEL RILASCIO/RINNOVO DELLA STESSA, PRESENTATO DAL CONS. COCCONCELLI IN DATA 28.5.2012 E SUCC. SOTTOSCRITTO DA ALTRI IN DATA 27.7.2012.",130038,2012,,,,33981
33984,OdG,2012-10-29,ORDINE DEL GIORNO PER INVITARE LA GIUNTA A PROMUOVERE IL TEATRO COMUNALE E A REPERIRE RISORSE PER INTERVENTI MANUTENTIVI PRESENTATO DAL CONSIGLIERE BUGANI ED ALTRI IN DATA 09.07.2012,170120,2012,,"PIAZZA MARCO - 33985"",""SALSI FEDERICA - 32861"",""MELEGA CORRADO - 27197"",""SCARANO PAOLA FRANCESCA - 33982",,33984
,Delibera di Consiglio,2012-10-29,"ISTITUZIONI 'GALLERIA D'ARTE MODERNA', 'MUSEI' E 'BIBLIOTECHE' DEL COMUNE DI BOLOGNA. APPROVAZIONE DEI CONTI CONSUNTIVI DELL'ESERCIZIO 2011 E DELLA DESTINAZIONE DEGLI AVANZI DI AMMINISTRAZIONE.",232186,2012,2012-10-31,,http://atti.comune.bologna.it/atti/delibere.nsf/0/F3DB73A28EA2EDAEC1257A6A004DF31F?OpenDocument,
,Delibera di Consiglio,2012-10-29,RIMBORSO ANTICIPATO DI MUTUI IN ESSERE CON LA CASSA DEPOSITI E PRESTITI PER UN IMPORTO MASSIMO DI 5 MILIONI DI EURO (ART. N. 8 C. 3 D.L. 174/2012) - VARIAZIONE AL BILANCIO DI PREVISIONE PER L'ESERCIZIO 2012.,246563,2012,2012-10-31,,http://atti.comune.bologna.it/atti/delibere.nsf/0/632898602C5737CFC1257A9B003373D7?OpenDocument,
27208,OdG,2012-11-05,"ORDINE DEL GIORNO PER INVITARE IL PARLAMENTE ED IL GOVERNO AD ASSICURARE LA MASSIMA PRIORITA' ALL'ASSISTENZA AI MALATI DI SLA, PRESENTATO DAI CONSIGLIERI TOMASSINI E GATTUSO NELLA SEDUTA DEL 5 NOVEMBRE 2012 E APPROVATO ALL'UNANIMITA' DEI PRESENTI NEL CORSO DELLA SEDUTA STESSA",261073,2012,,GATTUSO PATRIZIO GIUSEPPE - 20144,,27208
26392,OdG,2012-11-05,"ORDINE DEL GIORNO PER CONDANNARE OGNI FORMA DI DISCRIMINAZIONE E DI VIOLENZA CONTRO LE DONNE E GLI OMOSESSUALI, SIA ESSA VERBALE CHE FISICA, PRESENTATO DAI CONSIGLIERI CIPRIANI, BORGONZONI E ALTRI NELLA SEDUTA DEL 5 NOVEMBRE 2012 E APPROVATO NEL CORSO DELLA SEDUTA STESSA",261134,2012,,"ALDROVANDI STEFANO - 33986"",""BARCELO' LIZANA LEONARDO LUIS - 27189"",""BENASSI MARZIA - 33977"",""BORGONZONI LUCIA - 33983"",""CAVIANO PASQUALE - 32714"",""COCCONCELLI MIRKA - 33981"",""CRITELLI FRANCESCO - 29442"",""FERRI MARIARAFFAELLA - 27410"",""LA TORRE CATHY - 33979"",""LAMA ROSSELLA - 32704"",""LO GIUDICE SERGIO - 18313"",""MAZZANTI CLAUDIO - 9076"",""MELEGA CORRADO - 27197"",""MIGNANI MARIANNA - 32794"",""PETRELLA TOMMASO - 9097"",""PIERALISI MIRCO - 33980"",""TURCI DANIELA - 32708"",""LEMBI SIMONA - 32746"",""MARCHESINI ANGELO - 15586",,26392
27410,OdG,2012-11-05,"ORDINE DEL GIORNO PER CONDANNARE OGNI FORMA DI ATTEGGIAMENTO O LINGUAGGIO SESSISTA NELL'AMBITO DEL CONFRONTO POLITICO CHE CREI OFFESA AL GENERE O ALL'ORIENTAMENTO SESSUALE, PRESENTATO DALLA CONSIGLIERA FERRI E ALTRI NELLA SEDUTA DEL 5 NOVEMBRE 2012 E APPROVATO NEL CORSO DELLA SEDUTA STESSA",261142,2012,,"BARCELO' LIZANA LEONARDO LUIS - 27189"",""BENASSI MARZIA - 33977"",""CAVIANO PASQUALE - 32714"",""CIPRIANI LORENZO - 26392"",""CRITELLI FRANCESCO - 29442"",""ERRANI FRANCESCO - 33978"",""GHETTI MAURIZIO - 22034"",""LA TORRE CATHY - 33979"",""LAMA ROSSELLA - 32704"",""LEMBI SIMONA - 32746"",""LO GIUDICE SERGIO - 18313"",""MARCHESINI ANGELO - 15586"",""MAZZANTI CLAUDIO - 9076"",""MELEGA CORRADO - 27197"",""MIGNANI MARIANNA - 32794"",""PETRELLA TOMMASO - 9097"",""TURCI DANIELA - 32708"",""ZACCHIROLI BENEDETTO - 27481"",""PIERALISI MIRCO - 33980",,27410
21843,OdG,2012-11-12,"ORDINE DEL GIORNO PER INVITARE IL SINDACO E LA GIUNTA AD ATTIVARSI CON HERA S.P.A. AFFINCHE' SI ADOTTINO MISURE STRAORDINARIE DI LAVAGGIO DELLE STRADE E DEI PORTICI E DELLE PIAZZE IN ZONA UNIVERSITARIA (CON PARTICOLARE RIFERIMENTO A  PIAZZA VERDI, VIA PETRONI E LE ZONE ADIACENTI) PRESENTATO DAL CONSIGLIERE LISEI ED ALTRI IN DATA 11.06.2012",142565,2012,,"CARELLA DANIELE - 8904"",""CASTALDINI VALENTINA - 27997"",""FACCI MICHELE - 32712",,21843
18313,OdG,2012-11-12,"ORDINE DEL GIORNO PER ESPRIMERE SOLIDARIETA' AI CITTADINI VITTIME DELL'AGGRESSIONE AVVENUTA IN PIAZZA VERDI NELLA NOTTE DEL 9 GIUGNO 2012, PRESENTATO DAL CONSIGLIERE LO GIUDICE ED ALTRI IN DATA 11.6.2012.",142600,2012,,"CAVIANO PASQUALE - 32714"",""LA TORRE CATHY - 33979",,18313
,Delibera di Consiglio,2012-11-12,"APPROVAZIONE DEL SECONDO ADEGUAMENTO DEL 'PROGRAMMA DEI LAVORI PUBBLICI 2012-2014', DELL' 'ELENCO ANNUALE DEI LAVORI PER IL 2012' E DEL' PIANO POLIENNALE DEI LAVORI PUBBLICI E DEGLI INVESTIMENTI PER IL TRIENNIO 2012-2014'. AI SENSI DELL'ART. 128 DEL D.LGS.N. 163/2006,",249263,2012,2012-11-14,,http://atti.comune.bologna.it/atti/delibere.nsf/0/30176AC265E29A86C1257A9F0037DAC2?OpenDocument,
,Delibera di Consiglio,2012-11-19,"ASSESTAMENTO DEL BILANCIO DI PREVISIONE IN RAGIONE DELL'ANDAMENTO DELL'ESERCIZIO FINANZIARIO 2012 - ART. 175, COMMA 8, D.LGS. 267/2000 (RAG. IV).",248432,2012,2012-11-21,,http://atti.comune.bologna.it/atti/delibere.nsf/0/BF62881E38F0E361C1257A84002B13F0?OpenDocument,
,Delibera di Consiglio,2012-11-19,"APPROVAZIONE DELLA SPESA COMPLESSIVA DI EURO 150.000,00 PER LAVORI DI SOMMA URGENZA PER LA MESSA IN SICUREZZA DEL COPERTO DEL PALAZZO DELLO SPORT SITO IN PIAZZA AZZARITA.",252897,2012,2012-11-21,,http://atti.comune.bologna.it/atti/delibere.nsf/0/CBB6AD6591CF041DC1257AA20046349E?OpenDocument,
,Delibera di Consiglio,2012-11-19,PROGETTO 'PROCESSO PARTECIPATIVO E TOWN MEETING SULLO STATUTO PER LA CONVIVENZA E LA DEMOCRAZIA DELIBERATIVA NELLA CITTA' METROPOLITANA DI BOLOGNA'. ADESIONE DEL COMUNE DI BOLOGNA.,263359,2012,2012-11-21,,http://atti.comune.bologna.it/atti/delibere.nsf/0/17C2B9C0CD68A559C1257AB1004333FB?OpenDocument,
33986,OdG,2012-11-19,"ORDINE DEL GIORNO PER CHIEDERE ALLA GIUNTA DI PREDISPORRE IN BREVE PERIODO UN DOCUMENTO DA SOTTOPORRE AL CONSIGLIO COMUNALE CHE IDENTIFICHI LE VIE E FISSI I METODI PER LA CREAZIONE DI POSTI DI LAVORO NELLE IMPRESE BOLOGNESI, PRESENTATO DAL CONSIGLIERE ALDROVANDI E ALTRI NELLA SEDUTA DEL 19 NOVEMBRE 2012 E APPROVATO ALL'UNANIMITA' DEI PRESENTI NEL CORSO DELLA SEDUTA STESSA",272777,2012,,"BERNARDINI MANES - 32719"",""BUGANI MASSIMO - 33984"",""CAVIANO PASQUALE - 32714"",""COCCONCELLI MIRKA - 33981"",""LEMBI SIMONA - 32746"",""LISEI MARCO - 21843"",""LO GIUDICE SERGIO - 18313"",""MEROLA VIRGINIO - 16863"",""PIERALISI MIRCO - 33980"",""SCARANO PAOLA FRANCESCA - 33982",,33986
,Delibera di Consiglio,2012-11-26,ADEGUAMENTO 'TECNICO' DELLE PREVISIONI DEL VIGENTE BILANCIO PLURIENNALE PER GLI ESERCIZI 2013 E 2014 IN RELAZIONE ALLE RECENTI DISPOSIZIONI IN MATERIA DI FINANZA LOCALE DI CUI ALLA LEGGE N. 135/2012 'SPENDING REVIEW' E AL D.L. N. 174/2012.,259735,2012,2012-11-28,,http://atti.comune.bologna.it/atti/delibere.nsf/0/33FF6BA7004EC8BAC1257AA7004B9CCF?OpenDocument,
,Delibera di Consiglio,2012-11-26,VARIAZIONE AL BILANCIO DI PREVISIONE PER L'ESERCIZIO 2012 E AL BILANCIO PLURIENNALE 2012-2014 PER MAGGIORI ENTRATE A DESTINAZIONE VINCOLATA.,264281,2012,2012-11-28,,http://atti.comune.bologna.it/atti/delibere.nsf/0/0868520A4278B8EDC1257AB0004C62BC?OpenDocument,
,Delibera di Consiglio,2012-11-26,"VARIAZIONE AL BILANCIO DI PREVISIONE PER L'ESERCIZIO 2012, PER LA RIMODULAZIONE DI STANZIAMENTI RELATIVI AL REIMPIEGO DELL'IMPOSTA DI SOGGIORNO",269137,2012,2012-11-28,,http://atti.comune.bologna.it/atti/delibere.nsf/0/2E7043E703740CC3C1257AB80038D0FA?OpenDocument,
33985,OdG,2012-11-26,"ORDINE DEL GIORNO PER INVITARE IL SINDACO E LA GIUNTA, IN SEDE DI RIMODULAZIONE DEGLI STANZIAMENTI DELL'IMPOSTA DI SOGGIORNO, A CONFERMARE, FRA GLI OBIETTIVI PRIORITARI, IL FINANZIAMENTO DEI 250 ANNI DEL TEATRO COMUNALE, PRESENTATO DAL CONSIGLIERE PIAZZA E ALTRI NELLA SEDUTA DEL 26 NOVEMBRE 2012 E APPROVATO ALL'UNANIMITA' DEI PRESENTI NEL CORSO DELLA SEDUTA STESSA",278107,2012,,SCARANO PAOLA FRANCESCA - 33982,,33985
,OdG,2012-11-26,"ORDINE DEL GIORNO SULL'INTITOLAZIONE DI UNO SPAZIO PUBBLICO DELLA CITTA' DI BOLOGNA ALLA GIORNATA MONDIALE CONTRO LA VIOLENZA ALLE DONNE, PRESENTATO NEL CORSO DELLA SEDUTA CONGIUNTA DEL CONSIGLIO COMUNALE E PROVINCIALE DEL 26 NOVEMBRE 2012 E APPROVATO, ALL'UNANIMITA' DEI PRESENTI, NEL CORSO DELLA SEDUTA STESSA",278190,2012,,,,
,Delibera di Consiglio,2012-12-03,ACCETTAZIONE DI DONAZIONE DA PARTE DELLA SOCIETA' FINCOLOR SRL DI PICCOLA PORZIONE DI AREA DI CIRCA MQ 30 IN BOLOGNA PER LA REALIZZAZIONE DI UN PERCORSO PEDONALE PUBBLICO CHE COLLEGHI LA STRADA-PARCHEGGIO PUBBLICO REALIZZATA NELL'AMBITO DEL PRU R3.52* VIA DEL TUSCOLANO E VIA STENDHAL .,257562,2012,2012-12-05,,http://atti.comune.bologna.it/atti/delibere.nsf/0/6C557610E95FB17AC1257AA800314F78?OpenDocument,
,Delibera di Consiglio,2012-12-03,VARIANTE AL POC E AL RUE VIGENTI PER LA DISCIPLINA DI PARTE DELL' AMBITO IN TRASFORMAZIONE N. 129 BERTALIA-LAZZARETTO (ART. 20 DEL QUADRO NORMATIVO DEL PSC VIGENTE). ADOZIONE.,261011,2012,2012-12-05,,http://atti.comune.bologna.it/atti/delibere.nsf/0/CC884A571F25595CC1257AAE003395BF?OpenDocument,
,Delibera di Consiglio,2012-12-03,"ART.3 DEL D.P.R. N. 383 DEL 18 APRILE 1994. PARERE DI COMPETENZA PER LA REALIZZAZIONE DI VARIANTE ESSENZIALE AL PROGETTO DELL'UNIVERSITA' DEGLI STUDI DI BOLOGNA PER LA REALIZZAZIONE DEL 'CENTRO SERVIZI AREA CAVATICCIO',  A COMPLETAMENTO DELLA RESIDENZA STUDENTESCA DEL CASTELLACCIO, ALL'INTERNO DEL PRU MANIFATTURA TABACCHI. QUARTIERE PORTO.",264292,2012,2012-12-05,,http://atti.comune.bologna.it/atti/delibere.nsf/0/2ADCA41AD06FD2E6C1257AAF003C0EE5?OpenDocument,
,Delibera di Consiglio,2012-12-03,COSTITUZIONE DELLA NUOVA  ISTITUZIONE 'BOLOGNA MUSEI' E APPROVAZIONE DEL RELATIVO REGOLAMENTO.,269053,2012,2012-12-05,,http://atti.comune.bologna.it/atti/delibere.nsf/0/85AF7C3D7DCC85FDC1257AB000580E2A?OpenDocument,
,Delibera di Consiglio,2012-12-03,"CUP 2000 S.P.A.: AUMENTO DI CAPITALE SOCIALE A PAGAMENTO DI EURO 5.000,00, MEDIANTE EMISSIONE DI AZIONI SPECIALI, FINALIZZATO ALL'INGRESSO NELLA COMPAGINE SOCIETARIA DEL COMUNE DI FERRARA. MODIFICHE AGLI ARTICOLI 4 E 6 DELLO STATUTO SOCIALE,",274382,2012,2012-12-05,,http://atti.comune.bologna.it/atti/delibere.nsf/0/78E59FB2BD5D81BBC1257AB10038E7A0?OpenDocument,
15586,OdG,2012-12-03,ORDINE DEL GIORNO COLLEGATO ALLA DELIBERA DI CONSIGLIO N. 342/2012 TESO AD INVITARE IL SINDACO E LA GIUNTA A PROMUOVERE L'INTEGRAZIONE DEL FASCICOLO SANITARIO ELETTRONICO CON IL FUTURO FASCICOLO DEL CITTADINO CHE RAPPRESENTA UNO DEGLI OBIETTIVI DELL'AGENDA DIGITALE DEL COMUNE DI BOLOGNA PRESENTATO DAL CONSIGLIERE MARCHESINI ED ALTRI IN DATA 3.12.2012.,282926,2012,,"LO GIUDICE SERGIO - 18313"",""MELEGA CORRADO - 27197",,15586
,Delibera di Consiglio,2012-12-17,APPROVAZIONE DEL REGOLAMENTO PER L'OCCUPAZIONE DI SUOLO PUBBLICO PER SPAZI DI RISTORO ALL'APERTO ANNESSI A LOCALI DI PUBBLICO ESERCIZIO DI SOMMINISTRAZIONE,223063,2012,2012-12-20,,http://atti.comune.bologna.it/atti/delibere.nsf/0/C6AFD10BA54C7B8CC1257A84002911C1?OpenDocument,
,Delibera di Consiglio,2012-12-17,"APPROVAZIONE DELL'ADEGUAMENTO, A OTTOBRE 2012, DEL PIANO DELLE ALIENAZIONI E VALORIZZAZIONI DEL PATRIMONIO IMMOBILIARE.",267802,2012,2012-12-20,,http://atti.comune.bologna.it/atti/delibere.nsf/0/6AE80553FD07FF21C1257AAD0042918A?OpenDocument,
,Delibera di Consiglio,2012-12-17,PIANO SOSTA E SERVIZI COMPLEMENTARI ALLA MOBILITA': MODIFICA CLASSIFICAZIONE E SPECIFICHE TARIFFE UTILIZZO PARCHEGGIO EX BUTON (BORGO MASINI). AGGIORNAMENTI QUADRO TARIFFARIO.,274931,2012,2012-12-20,,http://atti.comune.bologna.it/atti/delibere.nsf/0/74A818476BBF3940C1257AB0004A0379?OpenDocument,
,Delibera di Consiglio,2012-12-17,"RIACCERTAMENTO DEI RESIDUI ATTIVI E PASSIVI AI SENSI DELL'ART.14 DEL DPCM 28.12.2011 'SPERIMENTAZIONE DELLA DISCIPLINA CONCERNENTE I SISTEMI CONTABILI E GLI SCHEMI DI BILANCIO DELLE REGIONI, DEGLI ENTI LOCALI E DEI LORO ORGANISMI, DI CUI ALL'ART.36 DEL D.LGS. 23/06/2011 N.118",274275,2012,2012-12-20,,http://atti.comune.bologna.it/atti/delibere.nsf/0/2E71A197EA356314C1257AB0003B1629?OpenDocument,
,Delibera di Consiglio,2012-12-17,"AUTORIZZAZIONE PER LA CONCESSIONE DI UNA FIDEIUSSIONE A FAVORE DI HERA SERVIZI CIMITERIALI S.R.L., A GARANZIA DEL MUTUO CONTRATTO CON UNIPOL BANCA SPA.",269155,2012,2012-12-20,,http://atti.comune.bologna.it/atti/delibere.nsf/0/518A6806B78F56BEC1257AB70039D2B5?OpenDocument,
,Delibera di Consiglio,2012-12-17,"RATIFICA DELIBERAZIONE P.G.N. 271437/2012 ADOTTATA IN VIA D'URGENZA DALLA GIUNTA COMUNALE, AI SENSI DEGLI ARTT. 42 E 175 DEL T.U. 267/2000. VARIAZIONE AL BILANCIO DI PREVISIONE PER L'ESERCIZIO 2012 E AL BILANCIO PLURIENNALE 2012/2014.",277818,2012,2012-12-20,,http://atti.comune.bologna.it/atti/delibere.nsf/0/F6681050745F82DEC1257AC3002BCE6A?OpenDocument,
,Delibera di Consiglio,2012-12-17,"RATIFICA DELIBERAZIONE P.G. 274562/2012 ADOTTATA IN VIA D'URGENZA DALLA GIUNTA COMUNALE, AI SENSI DEGLI ARTT. 42 E 175 DEL T.U. 267/2000. VARIAZIONE AL BILANCIO DI PREVISIONE PER L'ESERCIZIO 2012 E AL BILANCIO PLURIENNALE 2012/2014.",277985,2012,2012-12-20,,http://atti.comune.bologna.it/atti/delibere.nsf/0/8E4992B8528B970FC1257AC30030DD0E?OpenDocument,
,Delibera di Consiglio,2012-12-17,"PARZIALE MODIFICA PER MERO ERRORE MATERIALE, PIANO POLIENNALE LAVORI PUBBLICI E INVESTIMENTI TRIENNIO 2012-2014 APPROVATO CON DELIBERAZIONE N.318/2012 DEL 12.11.2012.",276153,2012,2012-12-20,,http://atti.comune.bologna.it/atti/delibere.nsf/0/DAEE5A5DF0A54246C1257AC500339993?OpenDocument,
,Delibera di Consiglio,2012-12-17,SCADENZE PAGAMENTO NUOVO TRIBUTO SUI RIFIUTI E SUI SERVIZI (ART.14 D.L.201/11) PER L'ANNO 2013 NELLE MORE DELL'APPROVAZIONE RELATIVA DISCIPLINA REGOLAMENTARE,287206,2012,2012-12-20,,http://atti.comune.bologna.it/atti/delibere.nsf/0/059ABC8C7B63F9DCC1257ACC005503D8?OpenDocument,
,Delibera di Consiglio,2012-12-18,"ABROGAZIONE DEL 'REGOLAMENTO PER IL FUNZIONAMENTO E LA GESTIONE DEL CANILE/GATTILE MUNICIPALE E LA DISCIPLINA DEI SERVIZI CORRELATI' E CONTESTUALE APPROVAZIONE DEL NUOVO 'REGOLAMENTO PER LA GESTIONE DEL CANILE/GATTILE MUNICIPALE, DEI SERVIZI CORRELATI E DEI RAPPORTI CON IL VOLONTARIATO'",226342,2012,2012-12-22,,http://atti.comune.bologna.it/atti/delibere.nsf/0/6361D0599392FC5BC1257A85002F1BEE?OpenDocument,
,Delibera di Consiglio,2012-12-18,ISTITUZIONE PER L'INCLUSIONE SOCIALE E COMUNITARIA 'DON PAOLO SERRA ZANETTI' DEL COMUNE DI BOLOGNA - APPROVAZIONE RENDICONTO DI GESTIONE 2011.,264782,2012,2012-12-22,,http://atti.comune.bologna.it/atti/delibere.nsf/0/5AC6CDD2E2DB1722C1257AAE0029EE8C?OpenDocument,
,Delibera di Consiglio,2012-12-18,"APPROVAZIONE MODIFICHE AL REGOLAMENTO PER L'OCCUPAZIONE DI SUOLO PUBBLICO E PER L'APPLICAZIONE DEL RELATIVO CANONE, APPROVATO CON DELIBERA PG 17044/2004 E SUCCESSIVE MODIFICHE",214839,2012,2012-12-22,,http://atti.comune.bologna.it/atti/delibere.nsf/0/65F94F28CCFF1384C1257AB70052157F?OpenDocument,
,Delibera di Consiglio,2012-12-18,"APPROVAZIONE ESITI VERIFICA COERENZA CON CONTENUTI AVVISO PUBBLICO, EX D. CC 135/2012, MANIFESTAZIONI DI INTERESSE PERVENUTE. LINEE GUIDA PER ELABORAZIONE POC DI QUALIFICAZIONE URBANA",277528,2012,2012-12-22,,http://atti.comune.bologna.it/atti/delibere.nsf/0/419F8DD5B5BA1EAFC1257ABD0034C7EA?OpenDocument,
32861,OdG,2012-12-18,"ORDINE DEL GIORNO COLLEGATO ALLA DELIBERA ODG 325/2012 TESO AD ABROGARE IL 'REGOLAMENTO PER IL FUNZIONAMENTO E LA GESTIONE DEL CANILE/GATTILE MUNICIPALE E LA DISCIPLINA DEI SERVIZI CORRELATI' E CONTESTUALMENTE AD APPROVARE IL NUOVO 'REGOLAMENTO PER LA GESTIONE DEL CANILE/GATTILE MUNICIPALE, DEI SERVIZI CORRELATI E DEI RAPPORTI CON IL VOLONTARIATO', PER INVITARE IL SINDACO E LA GIUNTA A VALUTARE L'OPPORTUNITA' DI ANDARE A GARA PER LE FORNITURE DI ALIMENTIDESTINATI AL CANILE, PRESENTATO DALLA CONS. SALSI IN DATA 10.12.2012 E SUCC. SOTTOSCRITTO DA ALTRI CONS. IN DATA 17.12.2012.",290482,2012,,LISEI MARCO - 21843,,32861
32861,OdG,2012-12-18,"ORDINE DEL GIORNO TESTO AD ABROGARE IL 'REG. PER IL FUNZIONAMENTO E LA GESTIONE DEL CANILE/GATTILE E LA DISCIPLINA DEI SERVIZI CORRELATI' E CONTESTUALMENTE AD APPROVARE IL NUOVO REGOLAMENTO E PER INVITARE SINDACO E GIUNTA AD INSERIRE NELLE FUTURE CONVENZIONI PRECISE INDICAZIONI SULLE MODALITA' CON LE QUALI I VOLONTARI DOVRANNO RAPPORTARSI CON ANIMALI MORDACI E FEROCI, PRESENTATO DALLA CONS. SALSI IN DATA 10.12.2012 E SUCCESSIVAMENTE SOTTOSCRITTO DA ALTRI CONS. IN DATA 17.12.2012",290424,2012,,LISEI MARCO - 21843,,32861
32861,OdG,2012-12-18,"ORDINE DEL GIORNO COLLEGATO ALLA DELIBERA ODG 325/2012 TESA AD ABROGARE IL 'REGOLAMENTO PER IL FUNZIONAMENTO E LA GESTIONE DEL CANILE/GATTILE MUNICIPALE E LA DISCIPLINA DEI SERVIZI CORRELATI' E CONTESTUALMENTE AD APPROVARE IL NUOVO 'REGOLAMENTO PER LA GESTIONE DEL CANILE/GATTILE MUNICIPALE, DEI SERVIZI CORRELATI E DEI RAPPORTI CON IL VOLONTARIATO, PER INVITARE SINDACO E GIUNTA AD ISTITUIRE UN ALBO DEI VOLONTARI ACCREDITATI ALL'ACCESSO DEL CANILE, PRESENTATO DALLA CONSIGLIERA SALSI IN DATA 11.12.2012 E SUCCESSIVAMENTE SOTTOSCRITTO DA ALTRI CONS. IN DATA 17.12.2012.",290158,2012,,LISEI MARCO - 21843,,32861
27208,OdG,2012-12-18,"ORDINE DEL GIORNO PER INVITARE IL SINDACO AD INSERIRE NEL SITO DEL COMUNE DI BOLOGNA UN BANNER CON LA DICITURA 'ADOZIONI ANIMALI CANILE' ATTRAVERSO IL QUALE DARE ACCESSO AD ORARI E GIORNATE DI APERTURA, NONCHE' ALLE PROCEDURE AD ALLA DOCUMENTAZIONE NECESSARIA PER L'AFFIDAMENTO E L'ADOZIONE DI CANI E GATTI. PRESENTATO DAL CONSIGLIERE TOMASSINI ED ALTRI IN DATA 17/12/2012.",295421,2012,,"BORGONZONI LUCIA - 33983"",""COCCONCELLI MIRKA - 33981"",""GATTUSO PATRIZIO GIUSEPPE - 20144",,27208
,Delibera di Consiglio,2013-01-07,APPROVAZIONE MODIFICHE E INTEGRAZIONI REGOLAMENTO DELL'IMPOSTA DI SOGGIORNO COMUNE DI BOLOGNA.,235268,2012,2013-01-09,,http://atti.comune.bologna.it/atti/delibere.nsf/0/3F79B80D14694641C1257AB700516410?OpenDocument,
,Delibera di Consiglio,2013-01-07,"APPROVAZIONE MODIFICHE E INTEGRAZIONI AL 'REGOLAMENTO DELLE ENTRATE COMUNALI E DELLA RELATIVA RISCOSSIONE', APPROVATO CON DELIBERAZIONE PG 161723/1998 E SS.MM.II.",214922,2012,2013-01-09,,http://atti.comune.bologna.it/atti/delibere.nsf/0/7F05E1DE2F700C66C1257AB70051E41F?OpenDocument,
,Delibera di Consiglio,2013-01-07,APPROVAZIONE DI MODIFICHE AL REGOLAMENTO PER L'APPLICAZIONE DELL'IMPOSTA DI PUBBLICITA' E PER L'EFFETTUAZIONE DEL SERVIZIO DELLE PUBBLICHE AFFISSIONI,225898,2012,2013-01-09,,http://atti.comune.bologna.it/atti/delibere.nsf/0/E48637B95CA7504DC1257AB70051B3BD?OpenDocument,
,Delibera di Consiglio,2013-01-07,"ADESIONE COMUNE DI BOLOGNA, IN QUALITA` DI SOCIO FONDATORE, ALLA FONDAZIONE 'ITS-SMAI - ISTITUTO TECNICO SUPERIORE PER LE NUOVE TECNOLOGIE PER IL MADE IN ITALY-SISTEMA MECCANICA-AUTOMAZIONE INDUSTRIALE'",277950,2012,2013-01-09,,http://atti.comune.bologna.it/atti/delibere.nsf/0/D19C058BF906E157C1257AC300326DA1?OpenDocument,
